{
  "schema_version": "1.1.0",
  "package_id": "ct-17-source-rights-review-packets-2026-07-15",
  "created_at": "2026-07-15T18:00:00Z",
  "retrieved_on": "2026-07-15",
  "status": "requires_authorized_review",
  "purpose": "Decision-ready official evidence packets for independent review of assessment/scoring and unresolved source uses. This package records evidence and questions only; it neither grants new approval nor revokes the existing PRIMAP factual-display and magnitude-comparison approval.",
  "immutable_inputs": {
    "source_registry": {
      "path": "data/climate/source-registry.json",
      "sha256": "ae32cc5799a96115d1b8568250638759020ff36cb1b6d1fa6aa032f56d07634d"
    },
    "ct15_readiness": {
      "path": "data/climate/releases/climate-evidence-licensing-readiness-2026-07-15.json",
      "sha256": "2939e0ab6eda7a5c90202c975826e8dcf33affda71cd0450ff499078b86478b4"
    },
    "ct16_policy": {
      "path": "data/climate/releases/source-routing-policy-v2-2026-07-15.json",
      "sha256": "5f7cdc800595a1c7fe5fbfddb1761142f6a6f097615aa6961119cf3ad80f6063"
    },
    "ct16_queue": {
      "path": "data/climate/releases/top20-source-routing-queue-v2-2026-07-15.json",
      "sha256": "bbfbd44df0f0768d8663ef0a810396fedbe66d9a92245222806e263dc15440bc"
    },
    "ct40_result": {
      "path": "data/climate/reviews/ct42-ct40-release-review-result.json",
      "sha256": "684f38b3741a57e86e60e92873ecaa36336eb496f0443647ec067c2ee885444a"
    }
  },
  "governance_boundary": {
    "source_registry_modified": false,
    "rights_decisions_made": false,
    "ct40_decision_modified": false,
    "preexisting_factual_tier_state": "eligible_unchanged",
    "preexisting_factual_facts": 2060,
    "new_normalized_fact_uses_authorized": false,
    "scoring_authorized": false,
    "release_authority": false,
    "production_runtime_release": false
  },
  "evidence_method": {
    "official_fact_label": "official_primary_page",
    "project_analysis_label": "project_inference_for_authorized_review",
    "live_page_capture_state": "urls_and_retrieval_dates_recorded_no_raw_page_copies",
    "raw_or_large_downloads_committed": false,
    "rule": "Official page metadata and factual summaries are evidence; rights interpretation, applicability and authorization remain questions for an authorized independent reviewer."
  },
  "required_decision_fields": [
    "decision_id",
    "decision_outcome",
    "source_registry_id",
    "reviewer_id",
    "reviewer_role",
    "reviewer_independence_confirmed",
    "reviewed_at",
    "decision_by",
    "decision_at",
    "reviewed_scope_confirmed",
    "reviewed_source_version",
    "reviewed_source_checksum_sha256_or_per_document_checksums",
    "licence_identifier",
    "terms_url",
    "licence_evidence_url_or_written_clarification_reference",
    "rights_holder_or_licensor_authority_confirmed",
    "conflicting_terms_resolved",
    "document_specific_exceptions_reviewed",
    "source_files_approved",
    "metadata_and_links_approved",
    "normalized_values_approved",
    "redistribution_approved",
    "derivative_database_use_approved",
    "commercial_use_approved",
    "transformation_approved",
    "scoring_approved",
    "attribution_approved",
    "attribution_template",
    "required_change_notice",
    "restrictions",
    "decision_scope",
    "source_registry_change_required",
    "expires_or_recheck_at",
    "decision_notes"
  ],
  "prohibited_inferences": [
    "permission from public availability",
    "permission from a download link or registry listing",
    "normalized-extraction permission from unchanged-document language",
    "scoring permission from factual-use permission",
    "family-wide permission from one document or component",
    "release authority from a source-registry state or this packet"
  ],
  "packets": [
    {
      "packet_id": "ct17-rights-primap-v2.6.1-final",
      "source_registry_id": "primap-hist-2.6.1-final",
      "source_title": "The PRIMAP-hist national historical emissions time series (1750–2023)",
      "status": "requires_authorized_review",
      "purpose": "Review assessment, scoring, derivative-database, and other uses of the exact frozen PRIMAP v2.6.1 CSV beyond the already approved factual-display and magnitude-comparison tiers.",
      "source_registry_snapshot": {
        "snapshot_kind": "pre_existing_registry_state_not_a_ct17_decision",
        "record_hash_sha256": "ac8789f4a513217ffe9bc3307d384b2a7d3dda08fe6386d119d1714924fe197b",
        "approval_state": "approved",
        "licence_status": "confirmed",
        "licence_identifier": "CC-BY-4.0",
        "redistribution_status": "permitted",
        "source_files_state": "recorded_allowed",
        "normalized_values_state": "recorded_allowed"
      },
      "exact_scope": {
        "scope_kind": "frozen_file",
        "source_version": "v2.6.1 final, published 13 March 2025",
        "doi": "10.5281/zenodo.15016289",
        "artifact_filename": "Guetschow_et_al_2025-PRIMAP-hist_v2.6.1_final_13-Mar-2025.csv",
        "artifact_sha256": "7607f2b7c5b00d3ddbb19e5c7b100ff7bd8c2d8c2bfc8959c40f41d2cfecf4d9",
        "publisher_checksum_algorithm": "md5",
        "publisher_checksum_value": "09b9c61629f87e16012222e5b303bc36",
        "captured_document_ids": [],
        "captured_document_checksums_sha256": [],
        "acquisition_state": "exact_sha256_pinned_no_raw_file_committed",
        "scope_note": "The SHA-256 is the exact project pin supplied for the named CSV. The official Zenodo record exposes the matching filename and an MD5, not this SHA-256. The existing source-registry decision and batch attestation already support factual display and magnitude comparison; this packet seeks independent review only for broader assessment/scoring uses."
      },
      "official_evidence": [
        {
          "evidence_id": "primap-zenodo-record-15016289",
          "evidence_type": "repository_record",
          "authority": "Zenodo / record depositors",
          "title": "The PRIMAP-hist national historical emissions time series (1750-2023) v2.6.1",
          "url": "https://zenodo.org/records/15016289",
          "retrieved_on": "2026-07-15",
          "page_state": "versioned_record_metadata_modified_2025-09-10",
          "evidence_origin": "official_primary_page",
          "official_factual_summary": [
            "The record identifies version v2.6.1, publication date 13 March 2025 and DOI 10.5281/zenodo.15016289.",
            "The record labels the dataset Creative Commons Attribution 4.0 International.",
            "The file list names the exact main CSV, reports a size of 74.7 MB and publishes MD5 09b9c61629f87e16012222e5b303bc36.",
            "The record asks users to cite the precise dataset version and the data-description article and to consider citing relevant original sources."
          ]
        },
        {
          "evidence_id": "cc-by-4.0-legal-code",
          "evidence_type": "licence_legal_code",
          "authority": "Creative Commons",
          "title": "Attribution 4.0 International legal code",
          "url": "https://creativecommons.org/licenses/by/4.0/legalcode.en",
          "retrieved_on": "2026-07-15",
          "page_state": "canonical_legal_code",
          "evidence_origin": "official_primary_page",
          "official_factual_summary": [
            "The legal code grants reproduction, sharing and adaptation of licensed material subject to its conditions.",
            "Sharing requires retention of supplied attribution and licence information and an indication of modifications.",
            "The licence covers only rights the licensor has authority to grant and does not license patent or trademark rights.",
            "The legal code addresses extraction and reuse where sui generis database rights apply."
          ]
        }
      ],
      "review_analysis": {
        "analysis_origin": "project_inference_for_authorized_review",
        "ambiguities": [
          "The official record publishes an MD5 for the named CSV, while the project pins a SHA-256; the exact-byte correspondence has not been independently attested in this packet.",
          "The dataset combines multiple underlying sources. The record-level CC BY statement does not by itself answer whether any source-specific rights or attribution duties survive for Earth Love United use.",
          "Zenodo flags a newer version; this packet intentionally covers only frozen v2.6.1 and must not be read as covering v2.7 or later releases."
        ],
        "restrictions_and_conditions_to_evaluate": [
          "Retain dataset authors, precise DOI, licence reference and modification notice in any approved use.",
          "Do not imply endorsement by authors, Zenodo or underlying data providers.",
          "Keep scenario, gas, sector, GWP, LULUCF, rounding and extrapolation choices visible in the transformation record."
        ],
        "attribution_questions": [
          "What exact public attribution template is sufficient for cards, globe tooltips, downloadable data and machine-readable metadata?",
          "Which underlying sources, if any, must also be credited for the selected rows and series?"
        ],
        "transformation_questions": [
          "Do selection, normalization, CO2e conversion, aggregation, rounding and visual scoring create adapted material or a derivative database, and how must changes be marked?",
          "May normalized values and derived scores be redistributed commercially under the record-level licence and the relevant underlying-source terms?"
        ],
        "questions_for_authorized_reviewer": [
          "Does an independent checksum verification confirm that the pinned SHA-256 belongs to the exact named v2.6.1 CSV whose Zenodo MD5 is recorded?",